{
	"$schema": "https://json-schema.org/draft-07/schema",
	"title": "Схема Конфигурации Корабля",
	"description": "Конфигурация корабля, используемая для определения новых классов кораблей.",
	"type": "object",

	"properties": {
		"map_name": {
			"title": "Название Класса",
			"type": "string",
			"description": "Название класса корабля, отображаемое в игре. Суффикс «-class» должен быть в нижнем регистре."
		},
		"map_short_name": {
			"title": "Сокращённое Название Класса",
			"type": "string",
			"description": "Сокращённая версия названия класса корабля, используется, например, в манифесте, а также используется для просмотр карт при покупке корабля, ссылаясь на сайт https://map.celadon.pro. Пробелы и символы запрещены. Исключения:'-' и '_'",
			"maxLength": 20
		},
		"description": {
			"title": "Описание Класса",
			"type": "string",
			"description": "Описание класса корабля. В настоящее время отображается показывается для игроков перед покупкой корабля, а также для администраторов в инструментах управления шаттлом.",
			"minLength": 250
		},
		"map_path": {
			"title": "Путь к Файлу Карты",
			"type": "string",
			"description": "Путь к файлу карты данного класса корабля. Используйте прямые слэши (/) для директорий и включайте расширение .dmm. Файлы карт должны находиться в папке '_maps/_mod_celadon'.",
			"pattern": "^_maps/([a-zA-Z0-9_/.-]*)dmm$"
		},
		"subshuttle": {
			"title": "Название Субшаттла",
			"type": "string",
			"description": "Название Субшаттла, что добавлен на карту материнского корабля. Используется для дополнительного вывода информации при покупке корабля, а также для ссылки на карту субшаттла на сайте корабля."
		},
		"enabled": {
			"title": "Доступность",
			"type": "boolean",
			"description": "Можно ли выбрать этот корабль игрокам. Админы всё равно смогут его заспавнить.",
			"default": false
		},
		"roundstart": {
			"title": "Случайный Выбор на Старте Раунда",
			"type": "boolean",
			"description": "Определяет, может ли этот корабль быть случайно выбран в качестве бесплатного стартового корабля.",
			"default": false
		},
		"limit": {
			"title": "Ограничение на Спавн Кораблей",
			"type": "integer",
			"description": "Максимальное количество кораблей этого класса, которое может быть заспавнено игроками за раунд.",
			"minimum": 0,
			"maximum": 100,
			"default": 1
		},
		"sensor_range": {
			"title": "Дальность Сенсоров",
			"type": "number",
			"description": "Определяет максимальную дальность сенсоров корабля."
		},
		"starting_funds": {
			"title": "Стартовые Средства Корабля",
			"type": "integer",
			"description": "Количество денег на банковском счёте корабля при старте.",
			"minimum": 0,
			"maximum": 20000,
			"default": 2000
		},
		"space_spawn": {
			"title": "Спавн в Космосе",
			"type": "boolean",
			"description": "Определяет, появится ли корабль в космосе или на аванпосте.",
			"default": false
		},
		"prefix": {
			"title": "Префикс Корабля",
			"type": ["null", "string"],
			"description": "Префикс класса корабля, который добавляется к случайно сгенерированным именам при покупке.",
			"maxLength": 6
		},
		"faction": {
			"title": "Фракция Корабля",
			"type": "string",
			"pattern": "^/datum/faction/(.*)$",
			"description": "Фракция по умолчанию."
		},
		"manufacturer": {
			"title": "Производитель Корабля",
			"type": ["null", "string"],
			"description": "Производитель класса корабля, в данный момент не используется, но будет использоваться в автоматических вики-шаблонах."
		},
		"tags": {
			"title": "Теги Корабля",
			"type": "array",
			"description": "Список тегов, описывающих особенности корабля, которые можно использовать для поиска."
		},
		"namelists": {
			"title": "Списки Имен",
			"type": "array",
			"description": "Список имен, из которого этот класс корабля будет выбирать случайное имя при покупке. Все варианты можно найти в файле ship_names.json.",
			"uniqueItems": true,
			"items": {
				"type": "string",
				"enum": [
					"GENERAL",
					"PIRATES",
					"BRITISH_NAVY",
					"MERCANTILE",
					"SPACE",
					"NATURAL",
					"NATURAL_AGGRESSIVE",
					"BEASTS",
					"MYTHOLOGICAL",
					"HISTORICAL",
					"WEAPONS",
					"PILLS",
					"ENGINEERING",
					"CRUISE",
					"MAGICAL",
					"STORYTELLING & TROPES",
					"warra",
					"INTEQ",
					"GORLEX",
					"SUNS",
					"CYBERSUN",
					"ACLF",
					"GEC",
					"DONK",
					"CLIP MINUTEMEN",
					"SAINT-ROUMAIN",
					"INSTALLATION",
					"SOLFED",
					"CMM-GOLD",
					"CMM-BARD",
					"PGF"
				]
			}
		},
		"job_slots": {
			"title": "Рабочие Места",
			"description": "Список рабочих мест, доступных на этом корабле. Первый слот всегда отводится под 'капитана', которым становится покупатель.",
			"type": "object",
			"additionalProperties": {
				"oneOf": [
					{
						"type": "integer",
						"description": "Предустановленная должность, должна совпадать с названием работы в коде (названия работ можно найти в соответствующих файлах)."
					},
					{
						"type": "object",
						"description": "Пользовательская должность, может быть любым названием, но требует указания униформы и количества слотов.",
						"properties": {
							"outfit": {
								"type": "string",
								"description": "Название униформы (outfit), которая будет использоваться в этом слоте. Должно быть точным, иначе вызовет ошибку.",
								"pattern": "^/datum/outfit/(.*)$"
							},
							"officer": {
								"type": "boolean",
								"description": "Определяет, является ли должность офицерской. Офицерские должности получают шеврон в манифесте, а количество их слотов нельзя изменять в игре.",
								"default": false
							},
							"slots": {
								"type": "integer",
								"description": "Количество доступных мест в этом слоте при старте раунда. Экипаж может изменить его в игре, но не более чем вдвое.",
								"minimum": 1
							}
						},
						"required": ["outfit", "slots"]
					}
				]
			}
		},
		"spawn_time_coeff": {
			"title": "Коэффициент Времени Спавна",
			"type": "number",
			"description": "Множитель, используемый для расчёта минимального времени игры в живом состоянии, необходимого для спавна этого корабля.",
			"minimum": 0,
			"default": 1
		},
		"officer_time_coeff": {
			"title": "Коэффициент Времени Офицера",
			"type": "number",
			"description": "Множитель, определяющий минимальное время игры в живом состоянии, необходимое для спавна в офицерской должности на этом корабле.",
			"minimum": 0,
			"default": 1
		}
	},
		"required": [
		"map_name",
		"map_short_name",
		"map_path",
		"faction",
		"job_slots"
	]
}
