{
	"$schema": "https://raw.githubusercontent.com/CeladonSS13/Shiptest/beta-dev/_maps/_mod_celadon/ship_config_schema.json",
	"map_name": "Caliban-class Modified Assault Vessel",
	"map_short_name": "Caliban",
	"description": "'Caliban' - это переделанное бронированное военное судно InteQ. Изначально данный корабль обладал килевым гибридным рельсотроном и внушительным количеством турелей точечной обороны. Ныне рельсотрон демонтирован, а батареи для него были заменены на хранилище или место было просто освобождено. После модификации корабль обладает маневренным десантным кораблем класса 'Tadpole', турелями, крепким корпусом и одним, но мощным двигателем. Сам корабль оснащен химической лабораторией, хирургией и достаточно развитым инженерным отделом, в то время как персонал делится на две части: судовой и боевой персонал. Судовой экипаж представляет собой санитара, занимающимся химией, двумя инженерами с их главой, а также арьергардом - офицером по связи и управлению кораблем в случае отсутствия капитана судна. Боевой персонал 'Caliban' мал для своего размера, однако он обладает невероятной гибкостью, командиром которого является почетный авангард в окружении элитной гвардии, обладающей экспериментальным оборудованием. Почетный авангард является символом 'братского' духа InteQ, работающий вместе со своими братьями и сестрами. Хоть тот и может стать лакомой целью пиратов или иных предприимчивых людей, но в данном случае безопасность его достигается броней корабля, его системами защиты, а также технологиями, которые оберегают отряд в бою.",
	"map_path": "_maps/_mod_celadon/shuttles/inteq/inteq_caliban.dmm",
	"subshuttle": "Tadpole",
	"enabled": true,
	"limit": 1,
	"sensor_range": 5,
	"prefix": "BIQSV",
	"faction": "/datum/faction/inteq",
	"tags": [
		"Флагман",
		"Суб-шаттл",
		"Инженерный"
	],
	"namelists": [
		"MYTHOLOGICAL",
		"NATURAL_AGGRESSIVE",
		"INTEQ"
	],
	"job_slots": {
		"Honorable Vanguard": {
			"outfit": "/datum/outfit/job/inteq/cel/honorable",
			"officer": true,
			"slots": 1
		},
		"Rearguard": {
			"outfit": "/datum/outfit/job/inteq/cel/rearguard",
			"officer": true,
			"slots": 1
		},
		"Artificer Class II": {
			"outfit": "/datum/outfit/job/inteq/cel/ce",
			"officer": true,
			"slots": 1
		},
		"Artificer": {
			"outfit": "/datum/outfit/job/inteq/cel/engineer",
			"slots": 2
		},
		"Corpsman": {
			"outfit": "/datum/outfit/job/inteq/cel/paramedic",
			"slots": 2
		},
		"Enforcer": {
			"outfit": "/datum/outfit/job/inteq/cel/security",
			"slots": 2
		}

	}
}
