{
	"$schema": "https://raw.githubusercontent.com/CeladonSS13/Shiptest/beta-dev/_maps/_mod_celadon/ship_config_schema.json",
	"map_name": "Forseti-class Patrol Cruiser",
	"map_short_name": "Forseti",
	"description": "Патрульно-полицейский Крейсер ”Forseti” оборудованный сабшаттлом ”Seer” является ответным ударом флота Федерации на участившиеся случае правонарушений среди гражданских суден. Данное судно, снабженное самым современным генератором энергии, ставит перед собой такую цель как: контроль гражданского оборота груза, миграции, контролем за соблюдением секториальных и федеративных прав и свобод, законодательств. Крейсер прекрасно оснащен нелетальными способами задержания и ведения боя.",
	"map_path": "_maps/_mod_celadon/shuttles/solfed/solfed_forseti.dmm",
	"subshuttle": "seer",
	"enabled": true,
	"limit": 1,
	"sensor_range": 5,
	"prefix": "SPSFSV",
	"faction": "/datum/faction/solgov",
	"tags": [
		"Боевой",
		"Суб-шаттл",
		"РП Фокус"
	],
	"namelists": [
		"SOLFED",
		"BRITISH_NAVY"
	],
	"job_slots": {
		"Kommandant": {
			"outfit": "/datum/outfit/job/cel/solfed/captain",
			"officer": true,
			"slots": 1
		},
		"Feldwebel": {
			"outfit": "/datum/outfit/job/cel/solfed/sergeant",
			"officer": true,
			"slots": 1
		},
		"Marine": {
			"outfit": "/datum/outfit/job/cel/solfed/marine",
			"slots": 5
		},
		"Meeresarzt": {
			"outfit": "/datum/outfit/job/cel/solfed/doctor",
			"slots": 2
		},
		"Marinemechaniker": {
			"outfit": "/datum/outfit/job/cel/solfed/engineer",
			"slots": 2
		},
		"Vertrags-Miner": {
			"outfit": "/datum/outfit/job/cel/solfed/miner",
			"slots": 2
		}
	}
}
