{
	"$schema": "https://raw.githubusercontent.com/CeladonSS13/Shiptest/beta-dev/_maps/_mod_celadon/ship_config_schema.json",
	"map_name": "Inqrutsio-Corvette Survey Ship",
	"map_short_name": "Inqrutsio",
	"description": "Корвет Солнечной Федерации предназначенный для сбора разведовательных данных, составления безопастных маршрутов, и в случае необходимости поддержки союзных сил. ",
	"map_path": "_maps/_mod_celadon/shuttles/solfed/solfed_inqrutsio.dmm",
	"enabled": true,
	"limit": 1,
	"sensor_range": 5,
	"prefix": "SPSFSV",
	"faction": "/datum/faction/solgov",
	"tags": ["Специализированный"],
	"namelists": [
		"SOLFED"
	],
	"job_slots": {
		"Expeditionary Kommandant": {
			"outfit": "/datum/outfit/job/cel/solfed/captain",
			"officer": true,
			"slots": 1
		},
		"Expeditionary Marine": {
			"outfit": "/datum/outfit/job/cel/solfed/marine",
			"slots": 1
		},
		"Expeditionary Meeresarzt": {
			"outfit": "/datum/outfit/job/cel/solfed/doctor",
			"slots": 1

		}
	}
}
