{
	"$schema": "https://raw.githubusercontent.com/CeladonSS13/Shiptest/beta-dev/_maps/_mod_celadon/ship_config_schema.json",
	"map_name": "Paracelsus-class Medical Corvette",
	"map_short_name": "Paracelsus",
	"description": "Выполняя свою роль медицинского центра соларианского флота, корвет класса 'Paracelsus' специально спроектирован для помощи соларианским флотам в медицинских проблемах, а также для снабжения таких судов медикаментами. Писари, получающие медицинское образование, часто работают на этих суднах, чтобы стать тенью опытных медиков и пройти ординатуру. В ЩИТСПАВНЕ ПО ПРИЧИНЕ: Неизвестный и непонятный шип!",
	"map_path": "_maps/_mod_celadon/shuttles/solfed/solfed_paracelsus.dmm",
	"enabled": false,
	"sensor_range": 4,
	"limit": 1,
	"prefix": "SFSV",
	"faction": "/datum/faction/solgov",
	"tags": ["РП Фокус", "Медицинское"],
	"namelists": [
		"SOLFED",
		"SPACE",
		"BRITISH_NAVY",
		"NATURAL"
	],
	"job_slots": {
		"Captain": {
			"outfit": "/datum/outfit/job/solfed/captain",
			"officer": true,
			"slots": 1
		},
		"Overseer": {
			"outfit": "/datum/outfit/job/solfed/hop",
			"officer": true,
			"slots": 1
		},
		"Medical Doctor": {
			"outfit": "/datum/outfit/job/solfed/doctor",
			"slots": 3
		},
		"Ship Engineer": {
			"outfit": "/datum/outfit/job/solfed/engineer",
			"slots": 1
		},
		"Field Engineer": {
			"outfit": "/datum/outfit/job/solfed/miner",
			"slots": 2
		},
		"Scribe": {
			"outfit": "/datum/outfit/job/solfed/assistant",
			"slots" : 3
		},
		"Attentive Care Patient": {
			"outfit": "/datum/outfit/job/solfed/patient",
			"slots" : 3
		}
	}
}
