{
	"$schema": "https://raw.githubusercontent.com/CeladonSS13/Shiptest/beta-dev/_maps/_mod_celadon/ship_config_schema.json",
	"map_name": "Cepheus-class Patrool Corvette",
	"map_short_name": "Cepheus",
	"description": "Корвет класса 'Cepheus' является патрульным судном Солнечной Федерации, предназначенный для поддержания порядка на территории планет NE-24774. Дополнительно оснащен роботехнической лабораторией в целях развертывания дополнительных наземных сил и оказания универсальной поддержки. В ЩИТСПАВНЕ ПО ПРИЧИНЕ: Не балансился, с рандомной платой меха раундстартом!",
	"map_path": "_maps/_mod_celadon/shuttles/solfed/solfed_cepheus.dmm",
	"enabled": false,
	"limit": 1,
	"sensor_range": 4,
	"prefix": "BSFSV",
	"faction": "/datum/faction/solgov",
	"tags": [
		"Боевой"],
	"namelists": [
		"SOLFED",
		"SPACE",
		"WEAPONS",
		"NATURAL"
	],
	"job_slots": {
		"Kommandant": {
			"outfit": "/datum/outfit/job/cel/solfed/captain",
			"officer": true,
			"slots": 1
		},
		"Marinemechaniker": {
			"outfit": "/datum/outfit/job/cel/solfed/engineer",
			"slots": 1
		},
		"Marine": {
			"outfit": "/datum/outfit/job/cel/solfed/marine",
			"slots": 2
		},
		"Mechanized Armor Pilot": {
			"outfit": "/datum/outfit/job/cel/solfed/marine/pilot",
			"slots": 2
		},
		"Roboterkonstrukteur": {
			"outfit": "/datum/outfit/job/cel/solfed/scientist/roboticist",
			"slots": 1
		}
	}
}
