{
	"$schema": "https://raw.githubusercontent.com/CeladonSS13/Shiptest/beta-dev/_maps/_mod_celadon/ship_config_schema.json",
	"map_name": "Firetail-class Expeditionary Frigate",
	"map_short_name": "Firetail",
	"description": "Фрегат класса 'Firetail' с субшаттлом класса 'Vespa' на борту – экспедиционно-патрульный корабль флота Солнечной Федерации, переоборудованный с поддержкой дочерней компании  'NanoTrasen™' - 'North Star™', что отвечала за оснащение корабля шахтёрским оборудованием и предоставлением дополнительных кадров, в лице шахтёров на контрактной основе. Сам корабль отличается наличием отделения телекоммуникаций и сбалансированным оборудованием, делая корабль полностью автономным и гибким, что идеально подходит для долгосрочных боевых миссий.",
	"map_path": "_maps/_mod_celadon/shuttles/solfed/solfed_firetail.dmm",
	"subshuttle": "Vespa",
	"enabled": true,
	"limit": 1,
	"sensor_range": 4,
	"prefix": "SPSFSV",
	"faction": "/datum/faction/solgov",
	"tags": [
		"Боевой",
		"Суб-шаттл"
	],
	"namelists": [
		"SOLFED",
		"BRITISH_NAVY"
	],
	"job_slots": {
		"Expeditionary Kommandant": {
			"outfit": "/datum/outfit/job/cel/solfed/captain",
			"officer": true,
			"slots": 1
		},
		"Expeditionary Feldwebel": {
			"outfit": "/datum/outfit/job/cel/solfed/sergeant",
			"officer": true,
			"slots": 1
		},
		"Expeditionary Marine": {
			"outfit": "/datum/outfit/job/cel/solfed/marine",
			"slots": 3
		},
		"Expeditionary Meeresarzt": {
			"outfit": "/datum/outfit/job/cel/solfed/doctor",
			"slots": 1
		},
		"Expeditionary Marinemechaniker": {
			"outfit": "/datum/outfit/job/cel/solfed/engineer",
			"slots": 1
		},
		"N+S Contracted Miner": {
			"outfit": "/datum/outfit/job/cel/solfed/nsminer",
			"slots": 2
		}
	}
}
