{
	"$schema": "https://raw.githubusercontent.com/CeladonSS13/Shiptest/beta-dev/_maps/_mod_celadon/ship_config_schema.json",
	"map_name": "Valor-Class Field Care Cruiser",
	"map_short_name": "Valor",
	"description": "'Valor' — специализированное медицинское судно флота Inteq, подходящее как для лечения раненых в боях членов Inteq, так и для платного лечения посторонних. Для этой цели он оснащен высококлассным медицинским оборудованием и небольшим шаттлом для перевозки пациентов.",
	"map_path": "_maps/_mod_celadon/shuttles/inteq/inteq_valor.dmm",
	"subshuttle": "Haste",
	"enabled": true,
	"limit": 1,
	"sensor_range": 5,
	"prefix": "SPIQSV",
	"faction": "/datum/faction/inteq",
	"tags": ["Медицинское", "Суб-шаттл"],
	"namelists": [
		"MYTHOLOGICAL",
		"NATURAL",
		"INTEQ"
	],
	"job_slots": {
		"Vanguard": {
			"outfit": "/datum/outfit/job/inteq/celadon/captain",
			"officer": true,
			"slots": 1
		},
		"Honorable Corpsman": {
			"outfit": "/datum/outfit/job/inteq/celadon/cmo",
			"officer": true,
			"slots": 1
		},
		"Corpsman": {
			"outfit": "/datum/outfit/job/inteq/celadon/paramedic",
			"slots": 3
		},
		"Enforcer": {
			"outfit": "/datum/outfit/job/inteq/celadon/security",
			"slots": 2
		},
		"Recruit": {
			"outfit": "/datum/outfit/job/inteq/celadon/assistant",
			"slots": 2
		}
	}
}
