{
	"$schema": "https://raw.githubusercontent.com/CeladonSS13/Shiptest/beta-dev/_maps/_mod_celadon/ship_config_schema.json",
	"map_name": "Tomahawk-class Scout Vessel",
	"map_short_name": "Tomahawk",
	"description": "Корабль Солнечной Федерации класса Томагавк служит для фронтовой разведки с боем, cо временем начала космических экспансий 23 века о чем может подсказывать его обшивка. Данный корабль обладает хорошей скоростью, не смотря на свои габариты. На судне предусмотрены рабочие места для двух медиков, трёх полевых инженеров и одного корабельного.",
	"map_path": "_maps/_mod_celadon/shuttles/solfed/solfed_tomahawk.dmm",
	"enabled": true,
	"limit": 1,
	"sensor_range": 4,
	"starting_funds": 2000,
	"prefix": "BSFSV",
	"faction": "/datum/faction/solgov",
	"tags": ["Боевой"],
	"namelists": [
		"SOLFED",
		"SPACE",
		"BRITISH_NAVY",
		"NATURAL"
	],
	"job_slots": {
		"Kommandant": {
			"outfit": "/datum/outfit/job/cel/solfed/captain",
			"officer": true,
			"slots": 1
		},
		"Feldwebel": {
			"outfit": "/datum/outfit/job/cel/solfed/sergeant",
			"officer": true,
			"slots": 1
		},
		"Marine": {
			"outfit": "/datum/outfit/job/cel/solfed/marine",
			"slots": 3
		},
		"Meeresarzt": {
			"outfit": "/datum/outfit/job/cel/solfed/doctor",
			"slots": 2
		},
		"Marinemechaniker": {
			"outfit": "/datum/outfit/job/cel/solfed/engineer",
			"slots": 1
		},
		"N+S Contracted Miner": {
			"outfit": "/datum/outfit/job/cel/solfed/nsminer",
			"slots": 2
		}
	}
}
