{
	"$schema": "https://raw.githubusercontent.com/CeladonSS13/Shiptest/beta-dev/_maps/_mod_celadon/ship_config_schema.json",
	"map_name": "Saber-class Patrool Corvette",
	"map_short_name": "Saber",
	"description": "Корабль класса `Сабля` это производящийся на территории NE-24761 патрульный корабль, используемый Анти-Террористическим корпусом Солнечной Федерации-52, для поддержания порядка, борьбы с преступностью и терроризмом. Конкретно данное судно принадлежит `Бригаде Элизиума`, добровольческом полку Солнечной Федерации состоящим из граждан Элизиума. Несмотря на то что они имеют собственную униформу, они подчиняются Солнечной Федерации.",
	"map_path": "_maps/_mod_celadon/shuttles/solfed/solfed_saber.dmm",
	"enabled": true,
	"limit": 1,
	"sensor_range": 4,
	"prefix": "BSFSV",
	"faction": "/datum/faction/solgov",
	"tags": ["Боевое", "РП Фокус"],
	"namelists": [
		"SOLFED",
		"SPACE",
		"WEAPONS",
		"NATURAL"
	],
	"job_slots": {
		"Musharif": {
			"outfit": "/datum/outfit/job/solfed/captain/elysium",
			"officer": true,
			"slots": 1
		},
		"Mulazim": {
			"outfit": "/datum/outfit/job/solfed/sergeant/elysium",
			"officer": true,
			"slots": 1
		},
		"Haris": {
			"outfit": "/datum/outfit/job/solfed/marine/elysium",
			"slots": 4
		},
		"Shafi": {
			"outfit": "/datum/outfit/job/solfed/doctor/elysium",
			"slots": 1
		},
		"Khabeer Fanni": {
			"outfit": "/datum/outfit/job/solfed/engineer/elysium",
			"slots": 1
		}
	}
}
