{
	"$schema": "https://raw.githubusercontent.com/CeladonSS13/Shiptest/beta-dev/_maps/_mod_celadon/ship_config_schema.json",
	"map_name": "Chronicle-class Research and Development Frigate",
	"map_short_name": "Chronicle",
	"description": "Научно-исследовательское судно класса 'Chronicle' — высокотехнологичный фрегат Солнечной Федерации, оснащённый всем необходимым для эффективных исследований в различных областях науки. Судно оборудовано дорогостоящим ядром ИИ и хранилищем для него, рассчитано на длительные экспедиции в удалённые сектора космоса, укомплектовано исследовательской группой из высококвалифицированных сотрудников под руководством научного руководителя и коменданта, а также всем, что необходимо для продуктивного старта экспедиций. Эти качества делают 'Chronicle' одним из лучших научных судов, когда‑либо разработанных Солнечной Федерацией.",
	"map_path": "_maps/_mod_celadon/shuttles/solfed/solfed_chronicle.dmm",
	"enabled": true,
	"limit": 1,
	"sensor_range": 4,
	"prefix": "SPSFSV",
	"faction": "/datum/faction/solgov",
	"tags": ["Исследовательский"],
	"namelists": [
		"SOLFED",
		"SPACE",
		"BRITISH_NAVY",
		"NATURAL"
	],
	"job_slots": {
		"Kommandant": {
			"outfit": "/datum/outfit/job/cel/solfed/captain",
			"officer": true,
			"slots": 1
		},
		"Scientific Overseer": {
			"outfit": "/datum/outfit/job/cel/solfed/doctor/medical_scientist/overseer",
			"officer": true,
			"slots": 1
		},
		"Marine": {
			"outfit": "/datum/outfit/job/cel/solfed/marine",
			"slots": 1
		},
		"Marinemechaniker": {
			"outfit": "/datum/outfit/job/cel/solfed/engineer",
			"slots": 1
		},
		"N+S Contracted Miner": {
			"outfit": "/datum/outfit/job/cel/solfed/nsminer",
			"slots": 2
		},
		"Field Science Assistant": {
			"outfit": "/datum/outfit/job/cel/solfed/scientist",
			"slots" : 2
		}
	}
}
