{
	"$schema": "https://raw.githubusercontent.com/CeladonSS13/Shiptest/beta-dev/_maps/_mod_celadon/ship_config_schema.json",
	"map_name": "Krait-class",
	"map_short_name": "Krait",
	"description": "Универсальный корабль класса 'Крайт', совмещает в себе две команды SnD и RnD. Команда SnD занимается поиском, захватом и уничтожением для второй команды занимающейся исследованиями. Корабль оснащен передовыми нанотехнологиями для более эффективной работы, обладает суб шаттлом для быстрого захвата и уничтожения объектов.",
	"map_path": "_maps/_mod_celadon/shuttles/syndicate/syndicate_krait.dmm",
	"subshuttle": "Jet_lancer",
	"enabled": true,
	"limit": 1,
	"sensor_range": 4,
	"prefix": "RSSV",
	"faction": "/datum/faction/syndicate",
	"tags": ["Исследовательский" ],
	"namelists": ["CYBERSUN", "GORLEX"],
	"job_slots": {
		"Search and Destroy Team Leader": {
			"outfit": "/datum/outfit/job/syndicate/cel/captain/gorlex",
			"officer": true,
			"slots": 1
		},
		"Search and Destroy team member": {
			"outfit": "/datum/outfit/job/syndicate/cel/security/gorlex",
			"slots": 3
		},
		"Research and Development Team Leader": {
			"outfit": "/datum/outfit/job/syndicate/cel/science/director",
			"officer": true,
			"slots": 1
		},
		"Research and Development team member": {
			"outfit": "/datum/outfit/job/roboticist",
			"slots": 3
		},
		"GEC Engineering": {
			"outfit": "/datum/outfit/job/syndicate/cel/engineer/gec",
			"slots": 2
		}
	}
}
