{
	"$schema": "https://raw.githubusercontent.com/CeladonSS13/Shiptest/beta-dev/_maps/_mod_celadon/ship_config_schema.json",
	"map_name": "Fist of Freedom-class Administrative Battleship",
	"map_short_name": "Fist-of-Freedom",
	"description": "Платформа “Длань” - это современная универсальная платформа для создания кораблей широкого спектра задач, от авианесущих крейсеров, до боевых, тяжеловооруженных артиллерийских линкоров. Данный корабль имеет компоновку `Кулак Свободы`. Это линкор, используемый для установления контроля военной администрации флота над малонаселенными системами, для поддержания порядка, борьбы с преступностью, пиратством и терроризмом. Этот корабль оснащён самым современным генератором энергии, имеет на борту хорошо вооруженное отделение морской пехоты, а также оборудованием для автономного существования без регулярных продовольственных и ресурсных поставок. Всё что нужно для наведения порядка в системе Адмиралу флота, который наделён особыми полномочиями командования всеми судами Солнечной Федерации.",
	"map_path": "_maps/_mod_celadon/shuttles/solfed/solfed_fist_of_freedom.dmm",
	"enabled": true,
	"limit": 1,
	"sensor_range": 5,
	"prefix": "ASFSV",
	"faction": "/datum/faction/solgov",
	"tags": ["Флагман", "Административный"],
	"namelists": [
		"SOLFED",
		"SPACE",
		"WEAPONS",
		"NATURAL"
	],
	"job_slots": {
		"Field Officer": {
			"outfit": "/datum/outfit/job/cel/solfed/captain/admiral",
			"officer": true,
			"slots": 1
		},
		"Personalvorgesetzter": {
			"outfit": "/datum/outfit/job/cel/solfed/hop",
			"officer": true,
			"slots": 1
		},
		"Feldwebel": {
			"outfit": "/datum/outfit/job/cel/solfed/sergeant",
			"officer": true,
			"slots": 1
		},
		"Marine": {
			"outfit": "/datum/outfit/job/cel/solfed/marine",
			"slots": 6
		},
		"Meeresarzt": {
			"outfit": "/datum/outfit/job/cel/solfed/doctor",
			"slots": 2
		},
		"Marinemechaniker": {
			"outfit": "/datum/outfit/job/cel/solfed/engineer",
			"slots": 2
		},
		"Gehilfe": {
			"outfit": "/datum/outfit/job/cel/solfed/assistant",
			"slots" : 3
		},
		"N+S Contracted Miner": {
			"outfit": "/datum/outfit/job/cel/solfed/nsminer",
			"slots": 2
		}
	}
}
